{
  "$schema": "../schemas/domain.v1.schema.json",
  "schema_version": "lifeos.domain.v1",
  "id": "plants",
  "label": "Plants",
  "home_surface": "plants.overview",
  "surfaces": [
    {
      "id": "plants.overview",
      "label": "Overview",
      "views": [
        "needs_attention",
        "watering",
        "growth"
      ],
      "collections": [
        "plant",
        "care_task"
      ]
    },
    {
      "id": "plants.journal",
      "label": "Journal",
      "views": [
        "timeline",
        "observations"
      ],
      "collections": [
        "plant_observation",
        "plant_journal"
      ]
    },
    {
      "id": "plants.supplies",
      "label": "Supplies",
      "views": [
        "inventory",
        "to_buy"
      ],
      "collections": [
        "plant_supply"
      ]
    }
  ],
  "collections": [
    "plant",
    "care_task",
    "plant_observation",
    "plant_journal",
    "plant_supply",
    "source_record"
  ],
  "visual_identity": {
    "domain": {
      "emoji": "🌿",
      "accent": "moss"
    },
    "surfaces": {
      "plants.overview": {
        "emoji": "🌱",
        "accent": "moss"
      },
      "plants.journal": {
        "emoji": "📓",
        "accent": "blue"
      },
      "plants.supplies": {
        "emoji": "🪴",
        "accent": "amber"
      }
    },
    "collections": {
      "plant": {
        "emoji": "🌿",
        "accent": "moss"
      },
      "care_task": {
        "emoji": "💧",
        "accent": "blue"
      },
      "plant_observation": {
        "emoji": "🔎",
        "accent": "plum"
      },
      "plant_journal": {
        "emoji": "📓",
        "accent": "blue"
      },
      "plant_supply": {
        "emoji": "🪴",
        "accent": "amber"
      },
      "source_record": {
        "emoji": "🔗",
        "accent": "neutral"
      }
    },
    "statuses": {
      "active": {
        "emoji": "✅",
        "accent": "moss"
      },
      "needs_attention": {
        "emoji": "❗",
        "accent": "amber"
      },
      "water": {
        "emoji": "💧",
        "accent": "blue"
      },
      "growth": {
        "emoji": "🌱",
        "accent": "moss"
      }
    },
    "actions": {
      "home": {
        "emoji": "⌂",
        "accent": "moss"
      },
      "add_record": {
        "emoji": "＋",
        "accent": "moss"
      },
      "capture": {
        "emoji": "＋",
        "accent": "moss"
      },
      "ask_with_collection": {
        "emoji": "✦",
        "accent": "plum"
      },
      "chat": {
        "emoji": "✦",
        "accent": "plum"
      },
      "search": {
        "emoji": "⌕",
        "accent": "blue"
      },
      "open_sources": {
        "emoji": "🔗",
        "accent": "neutral"
      },
      "settings": {
        "emoji": "⚙",
        "accent": "neutral"
      },
      "add_domain": {
        "emoji": "＋",
        "accent": "plum"
      },
      "review": {
        "emoji": "👀",
        "accent": "amber"
      },
      "refresh": {
        "emoji": "↻",
        "accent": "blue"
      },
      "capture_note": {
        "emoji": "📝",
        "accent": "neutral"
      },
      "capture_food": {
        "emoji": "🌿",
        "accent": "moss"
      },
      "capture_photo": {
        "emoji": "▧",
        "accent": "blue"
      },
      "capture_receipt": {
        "emoji": "🧾",
        "accent": "plum"
      },
      "capture_voice": {
        "emoji": "◖",
        "accent": "amber"
      },
      "capture_link": {
        "emoji": "⌁",
        "accent": "blue"
      }
    },
    "sources": {
      "notion": {
        "emoji": "◨",
        "accent": "neutral"
      },
      "google_sheets": {
        "emoji": "▦",
        "accent": "moss"
      },
      "sqlite": {
        "emoji": "▣",
        "accent": "blue"
      },
      "postgres": {
        "emoji": "⬢",
        "accent": "plum"
      },
      "web": {
        "emoji": "🌐",
        "accent": "blue"
      },
      "user": {
        "emoji": "🙂",
        "accent": "moss"
      }
    },
    "skills": {
      "plants": {
        "emoji": "🌿",
        "accent": "moss"
      },
      "source_verifier": {
        "emoji": "🔎",
        "accent": "blue"
      }
    },
    "agents": {
      "plant_brain": {
        "emoji": "✦",
        "accent": "moss"
      },
      "source_steward": {
        "emoji": "🔗",
        "accent": "blue"
      }
    }
  },
  "relations": [
    {
      "from": "care_task",
      "to": "plant",
      "name": "cares_for"
    },
    {
      "from": "plant_observation",
      "to": "plant",
      "name": "observes"
    },
    {
      "from": "plant_supply",
      "to": "plant",
      "name": "supports"
    },
    {
      "from": "source_record",
      "to": "*",
      "name": "supports"
    }
  ],
  "skills": [
    "plants"
  ],
  "workflows": [],
  "data_homes": [
    "notion",
    "google_sheets",
    "sqlite",
    "postgres"
  ],
  "render": {
    "answer_label": "Plants",
    "empty_intro": "No matching local Plant records were loaded. Connect a source or add plants, care tasks, and observations, then ask again.",
    "default_title": "Local Plants answer",
    "default_intro": "I found {count} local Plant record{plural} tied to this question.",
    "default_columns": [
      "Record",
      "Status",
      "Context"
    ],
    "default_fields": [
      "title",
      "status",
      "body"
    ],
    "card_bullets": [
      "status",
      "body",
      "meta"
    ],
    "source_quote_fields": [
      "body",
      "meta",
      "status"
    ],
    "source_exclude_fields": [
      "tone",
      "food_detail"
    ],
    "intents": {
      "care": {
        "terms": [
          "water",
          "light",
          "care",
          "feed",
          "rotate",
          "today"
        ],
        "title": "Local Plant care answer",
        "intro": "I found {count} local Plant care record{plural} with relevant next actions.",
        "columns": [
          "Record",
          "Care state",
          "Context"
        ],
        "fields": [
          "title",
          "status",
          "body"
        ],
        "boost_collections": [
          "plant",
          "care_task",
          "plant_journal"
        ]
      },
      "supplies": {
        "terms": [
          "soil",
          "pot",
          "fertilizer",
          "supply",
          "buy",
          "low"
        ],
        "title": "Local Plant supplies answer",
        "intro": "I found {count} local Plant supply record{plural}.",
        "columns": [
          "Record",
          "Status",
          "Context"
        ],
        "fields": [
          "title",
          "status",
          "body"
        ],
        "boost_collections": [
          "plant_supply"
        ]
      }
    }
  },
  "mcp": {
    "resources": [
      "domain_manifest",
      "schema",
      "record",
      "source_snapshot",
      "conversation"
    ],
    "tools": [
      "search",
      "read_record",
      "create_record",
      "update_record",
      "archive_record"
    ]
  }
}
